{
  "schema_version": "2.0",
  "store_id": "f1e2d3c4-0000-4000-8000-000000000001",
  "hour_bucket": "2026-05-29T14:00:00Z",
  "timezone": "Africa/Johannesburg",
  "format_clock_id": "ab120000-0000-4000-8000-000000000002",
  "format_clock_version": 3,
  "schedule_revision": "sha256:abc",
  "compiled_at": "2026-05-29T13:42:01Z",
  "total_duration_ms": 120000,
  "items": [
    { "seq": 0, "family": "music", "media_id": "11110000-0000-4000-8000-00000000000e",
      "uri": "s3://rr-media/tracks/ghi.mp3", "duration_ms": 120000, "timing_rule": "soft", "start_offset_ms": null }
  ]
}
